{
  "scheme_id": "us-stanford-ug-4pt3-current",
  "university": {"slug": "stanford", "name": "Stanford University", "country_iso2": "US", "homepage": "https://www.stanford.edu/"},
  "country": {"iso2": "US", "name": "United States"},
  "faculty_program": {"slug": "general-university", "name": "General University Grading System", "kind": "university_wide"},
  "degree_level": "undergraduate",
  "academic_year": {"start": 1986, "label": "1986–present (GPA on transcript)", "open_ended": true},
  "name": "Stanford General University 4.3 GPA",
  "grade_boundaries": [
    {"symbol": "A+", "grade_points": 4.3, "passing": true},
    {"symbol": "A", "grade_points": 4.0, "passing": true},
    {"symbol": "A-", "grade_points": 3.7, "passing": true},
    {"symbol": "B+", "grade_points": 3.3, "passing": true},
    {"symbol": "B", "grade_points": 3.0, "passing": true},
    {"symbol": "B-", "grade_points": 2.7, "passing": true},
    {"symbol": "C+", "grade_points": 2.3, "passing": true},
    {"symbol": "C", "grade_points": 2.0, "passing": true},
    {"symbol": "C-", "grade_points": 1.7, "passing": true},
    {"symbol": "D+", "grade_points": 1.3, "passing": true},
    {"symbol": "D", "grade_points": 1.0, "passing": true},
    {"symbol": "D-", "grade_points": 0.7, "passing": true},
    {"symbol": "NP", "grade_points": 0.0, "passing": false, "counts_toward_credits": false},
    {"symbol": "CR", "grade_points": null, "counts_toward_gpa": false, "passing": true},
    {"symbol": "NC", "grade_points": null, "counts_toward_gpa": false, "passing": false, "counts_toward_credits": false}
  ],
  "credit_system": {"unit": "quarter_hour", "typical_full_time_load_per_year": 45},
  "gpa_formula": {"kind": "weighted_mean", "scale_max": 4.3, "scale_min": 0.0, "rounding": "none", "decimal_places": 2, "description": "Sum(gp x units)/Sum(units A+ through NP).", "expression": "sum(gp * units) / sum(units)"},
  "repeat_course_rules": {"kind": "unknown", "description": "Repeat mechanics not fully captured.", "provenance": {"status": "unverified"}},
  "pass_fail": {"treatment": "exclude_from_gpa", "pass_symbols": ["CR"], "fail_symbols": ["NC"], "description": "CR/NC excluded; NP at 0.0 in GPA."},
  "degree_classification": {"applies": false, "description": "No class ranking."},
  "official_sources": [{"title": "How Do I Calculate My GPA?", "url": "https://studentservices.stanford.edu/my-academics/evaluations-exams-grades/grades/how-do-i-calculate-my-grade-point-average-gpa", "source_class": "registrar", "retrieved": "2026-09-18"}],
  "verification_date": "2026-09-18",
  "unverified_fields": ["repeat_course_rules.kind"]
}
